"seq","Hash","string"
"63","76b6a292","I'm looking for fertilizer to help me make some tasty meat,
but I'm having a little trouble. That's where you come in."
"70","7db6ad97","Bring me a Cheerful Apple, a Digistalk, and a Salty Fruit
whenever you can! Got all that?"
"82","8a53f564","Oh sweet! You brought all three of 'em!"
"84","8b53f6d7","Thanks a bunch! Just what I needed for my fertilizer.
Alright, time to grow some delicious meat!"
"95","5b67d268","Ta-daaah! A Recovery Disk! Just what every Tamer needs!
I can let it go now for a paltry sum of 100 <icon>BIT</icon>!"
"123","e960632d","You got Recovery Disk x 1!"
"205","a5d02436","YOU DO NOT UNDERSTAND? YOU ARE NOT THE 
SHARPEST KNIFE IN THE DRAWER, ARE YOU?"
"324","10717c72","The truth is, my brother Leomon is fighting a tough battle
in the Ohguino Wilderness beyond this sand wall..."
"341","157ce315","My turbines are all scorched from using my special move...
I don't think I can go on like this..."
"343","177aa784","Please, go to the Ohguino Wilderness and help Leomon for me!"
"390","37a86498","I heard whispers in the wind of you, and now I wish to
engage you in combat..."
"466","40abdb5f","Wait, am I getting ahead of myself? You got something you
wanna say to me first?"
"500","a091bc20","OmegaShoutmon joined the city!"
"503","b8b3dfd9","Give back the Myobrella you stole!
...Or maybe not."
"507","bcb3e605","It was a slip of the tongue, this one knows not of such a Digimon!
If you would doubt this one, fight and find out for yourself!"
"515","df8a9f6a","Oh, it is to protect against the harmful rays of the sun?
But Myotismon looked fine to this one... perhaps it's for fashion?"
"526","4eba4a40","This one knows nothing of items stolen by nefarious Digimon.
That matter is left to you."
"536","521a94ab","If you're gonna be Angemon's lapdog, then come at me!"
"561","9711514a","Ho ho! You think you can beat me?! I'll burn that confidence
right to the ground!"
"583","feae3ac1","The answer isn't nine! You're a clone!
The answer is nine! It IS the real you!"
"584","fbae3608","...In that case, ask one of the other ones for their question."
"592","3e7b98ec","The answer isn't nine! You're a clone!
The answer is nine! It IS the real you!"
"593","417b9da5","...In that case, ask one of the other ones for their question."
"594","407b9c32","Splendid! You are correct!"
"595","437ba08b","All of these sayings have three in them...so when you add
them up, they equal nine!"
"598","420ddcd2","June is the 6th month, July is the 7th month, August is the 8th
month...and November is the Xth month."
"601","3d0dd533","The answer isn't nine! You're a clone!
The answer is nine! It IS the real you!"
"602","3e0dd6a6","...In that case, ask one of the other ones for their question."
"612","da0264ea","Thank you, kind one! It is a race against time. I need you
to stop that rampaging Digimon..."
"615","d7026011","...but I have just awoken, and it seems that foe is somehow
preventing me from replenishing my energy."
"623","348eb39","Susanomon joined the city!"
"791","737de5f0","...Like about laying waste to the Meaty Troop Digimon and
Ohguino Wilderness? You know about all that?!"
"796","31a0690d","...Like how we'll shoot a laser using ShineGreymon's solar
power, laying waste to the Meaty Troops and Ohguino?!"
"798","55697268","The one enticing Rosemon to raze the Ohguino Wilderness so
we can develop the land afterwards...?"
"805","ca274138","Hey you! What're you doing here?!"
"806","cd2745f1","I am Leomon, the leader of the Meaty Troops of the Ohguino
Wilderness."
"818","c124f476","The truth is, us Meaty Troops and Rosemon's Veggie Troops
are clashing here in the Ohguino Wilderness..."
"826","9dd82353","We need you to understand more about the Ohguino Wilderness.
Try and get some info out of the Veggie Troops!"
"828","9183af86","You've learned what's happening in the Ohguino Wilderness!"
"851","d91bf991","That damn Rosemon! To think they plan to burn down all of
the Ohguino Wilderness with a laser!"
"855","d51bf365","The Ohguino Wilderness, and the lives of all the Digimon who
live here, are counting on you! Good luck!"
"857","1515204","The Ohguino Wilderness, and the lives of all the Digimon who
live here, are counting on you! Good luck!"
"860","e8e36a16","All of this is thanks to your hard work! The Meaty Troops...
no, all of us Digimon in the Ohguino Wilderness thank you!"
"907","9e43cb6a","AND I SHALL SOUNDLY TROUNCE YOU IF YOU ATTEMPT TO PASS!"
"912","336676ff","AND I SHALL SOUNDLY TROUNCE YOU IF YOU ATTEMPT TO PASS!"
"920","ee1c156d","Well, too late! With the energy harvested from ShineGreymon,
the laser's ready to fire on the Ohguino Wilderness!"
"921","ed1c13fa","Those savage Meaty Troops and all of the Wilderness will go
up in flames! But it's no fun in firing it right away..."
"925","e91c0d4e","Your fear has gotten the better of you, has it? Very well...
I can wait a little while longer!"
"962","79de60dd","I see... While I've been captured, such a fate has befallen
this Ohguino Wilderness..."
"968","efdb4928","My beloved Ohguino Wilderness is in danger. I wish I could
fight with you, but this body would only get in your way..."
"970","f1db4c0e","I see, you stopped them from firing the laser! Please, go
tell Leomon at once!"
"973","f7304337","But thanks to all your hard work, peace has returned to
these Ohguino Wilderness..."
"974","f4303e7e","That is why I can end my watch over the Wilderness without
worry, and heal myself with this warm light shining down..."
"981","b7f94d15","But thanks to all your hard work, peace has returned to
this Ohguino Wilderness..."
"988","5c527367","The truth is, a great pirate of the Digi-seas finally wound up
here after his last voyage!"
"989","59526eae","According to legend, the captain retired from the seas, and
lives here to this day..."
"990","5a527001","There's a super-valuable Holy Chalice hidden somewhere
around here! That's where you come in, buddy..."
"1101","7884dba4","I made you worry too, didn't I, buddy? ...my bad. Master and
apprentice will be back together in no time! Peace out!"
"1134","8d520a7f","And not any old Digimon, either. Among sea dragon types, I'm
an elite Perfect Digimon!"
"1162","fda233a8","...I won't let you do any more fishing! All right, now get
outta here!"
"1191","2f236e76","I, who fight alone, and you, who fight with two Digimon...
We do things differently, yet we seek the same strength."
"1226","b2645b61","HAGURUMON IS IN THE CONTROL ROOM OF FAULT EX MACHINA!
I HAVE AN URGENT TASK AS WELL! PLEASE HURRY BACK!"
"1229","6f2e5577","HAGURUMON IN THE CONTROL ROOM OF FAULT EX MACHINA SHOULD
HAVE IT! PLEASE HURRY AND GET IT!"
"1269","a4c82221","Lately two ferocious Digimon have been fighting here in
Fault Ex Machina...rampaging anytime and any place."
"1272","a1c81d68","I've stopped them time and time again, but I had to give up
to save myself. Still, maybe you can do something to help?"
"1286","4227c273","Hey, you there! This ain't a spectator sport! Clear off if
you don't wanna get hurt!"
"1387","2257c622","Correct again! Lookit the brainiac over here! Terriermon's
single horn plus Lopmon's three horns add up to four!"
"1401","581c3dd2","Anything's okay? In that case, we'll go join the city!"
"1413","4fbd8733","Garurumon should be in the Ohguino Wilderness."
"1467","5b02dcaf","AHH-WOO-WOO-WOOOOO! You're amazing, kid! Check it
out, this engraving right here is just DOPE, ain't it?!"
"1468","5802d7d6","S got a real, y'know, skull-y grey-y feel to it, yeah?
It's perfect, just perfect..."
"1481","8c72d37f","Oof, I surrender! Okay, here's one ring. What do you plan
to do with this, exactly?"
"1499","e26adbc1","Oh hey, you there! Come chat a bit, I gotta talk to ya!"
"1507","da6acf69","This mic takes a Digi-Battery, ya dig? There should be more
in Fault Ex Machina's Control Room! Thanks, baby!"
"1509","5a9a9502","You've just GOTTA bring a Digi-Battery for my mic, okay,
baby? It should be in Fault Ex Machina's Control Room!"
"1516","574a41bc","Aw yeah, it's perfect! Now I can practice all I like for the
recital!"
"1539","9f4020e2","...Jeez, I'm so sorry... This is all my fault... As a way of
apologizing...I'll go to the city..."
"1601","e186be3f","{0}, harbinger of peace for this world!
I am known as LordKnightmon, of the Royal Knights!"
"1613","f824154a","LordKnightmon joined the city!"
"1738","311b50b0","And were a good Ultimate Digimon such as I to make contact with
this pure evil, I fear the corruption might infect me..."
"1773","99ef3764","Hmph... I imagine you're itching to go on ahead, but if you
want to pass, you'll have to defeat the Digimon before you."
"1774","9cef3c3d","I bet you're thinking, ""it's just one opponent, what's the
big deal?"" ...Surprised? I can read your mind, buddy…"
"1830","39dd2985","HMM...I HAVE NOT SEEN YOUUU BEFORE...WHY ARE YOUUU HERE?"
"1832","33dd2073","I WAS BEATEN BY A DIFFERENT HUUUMAN FROM YOUUU, 
AND WOUUUND UP HERE."
"1833","32dd1e80","MAYBE THAT HUUUMAN IS FURTHER AHEAD IN THIS AREA. YOUUU
WOULD GO TO DEFEAT THEM, WOULDN'T YOUU."
"1834","35dd2359","IN THAT CASE...YOUUU AND I HAVE THE SAME GOAL. BUT DON'T
THINK I CAN TRUST WHAT YOUUU SAY JUST LIKE THAT..."
"1835","34dd21e6","IF WHAT YOUUU SAY IS TRUE...THEN I MUUUST TEST YOUUU FIRST
IN BATTLE!"
"1846","b63063bd","I FEEL SO REFRESHED AFTER FIGHTING YOUUU! MAYBE I'LL GO AND
CHECK OUUUT FLOATIA."
"1858","52d6ea02","That is Taomon's Taoist charm, is it not? Use it, and
boom..."
"1859","53d6ebf5","I cannot use it myself.
Sorry, I have something to do."
"1866","14a0ec37","C'mon, use that Taoist charm, just a little!"
"1887","92ee0939","First, let me name myself... I am SaintGargomon..."
"1889","94ee0c1f","That Digimon is RustTyranomon! I drove him off just before he
annihilated our world... He is destruction personified..."
"1901","6306f979","SaintGargomon joined the city!"
"1908","f9d6a3da","Thus, I must ask you...in order to refill my energy, would
you bring me a Large Double Disk?"
"1912","dc0fa5a3","In order to get enough energy to escape the Infinite
Cauldron, I need you to bring me a Large Double Disk!"
"1914","8bdaad6","You brought me a Large Double Disk?!"
"1915","7bda963","Here's a Large Double Disk for you!
I can't give you one yet..."
"1916","6bda7f0","You handed over one Large Double Disk!"
"1924","4ef98345","Oh, human child... Somehow I have appeared in this world..."
"1954","fcc15380","Bzz...zzz...zzzt... This noise in my electronic brain...
Damn that SaintGargomon..."
"2005","91ad742f","Damn... You are quite the fascinating Tamer... In this case,
I must request one final battle..."
"2022","bc287fa7","S true, he hasn't come play fer a while, but..."
"2050","a028735f","The explanation was interrupted, so it will restart.
(Moving to the point where the interruption occurred.)"
"2052","842a85c3","This area has an ingredient (Digishroom) and a material
(Metal). Now, try getting some ingredients and materials!"
"2103","966bdbbe","You enjoying yourself, {0}?
Let me have some fun, too!"
"2125","26490eb0","120 seconds restored!
All of your <icon>BIT</icon> were stolen!"
"2139","81dd5f1d","You got DigiHolywater, DigiDiamond, Blue Digizoit and
DigiGodwood x 3!"
"2162","63aa300d","I'm training here so I can beat you next time.
You'd better make yourself stronger! Take this."
"2163","63aa300c","Tamer experience increased by 2,000!"
"2164","63aa300f","I haven't trained enough to beat you yet.
But I will defeat you one day!"
"2165","63aa300e","Your Tamer level is maxed out.
Never mind. Take this instead."
"2166","63aa3009","You got 1,000 <icon>LUCK</icon>!"
"2173","85704d4b","You got Recovery Disk x 1!"
"2174","85704d4a","You got MP Disk x 1!"
"2176","85704d4c","You got Bandage x 1!"
"2178","d3a511cd","You got Recovery Disk x 1!"
"2179","d3a511cc","You got MP Disk x 1!"
"2181","d3a511ca","You got Bandage x 1!"
"2184","3e74b1f9","You got Recovery Disk x 1!"
"2185","3e74b1f8","You got MP Disk x 1!"
"2187","3e74b1fe","You got Bandage x 1!"
"2190","8bc46490","You got Recovery Disk x 1!"
"2191","8bc46491","You got MP Disk x 1!"
"2193","8bc46497","You got Bandage x 1!"
"2196","84c900ef","You got Recovery Disk x 1!"
"2197","84c900ee","You got MP Disk x 1!"
"2199","84c900e8","You got Bandage x 1!"
"2202","fe759b86","You got Recovery Disk x 1!"
"2203","fe759b87","You got MP Disk x 1!"
"2205","fe759b81","You got Bandage x 1!"
"2208","10a4056d","You got Recovery Disk x 1!"
"2209","10a4056c","You got MP Disk x 1!"
"2211","10a4056a","You got Bandage x 1!"
"2214","74040224","You got Recovery Disk x 1!"
"2215","74040225","You got MP Disk x 1!"
"2217","74040223","You got Bandage x 1!"
